{
  "schema_version": 1,
  "assurance_framework": "JSP-453",
  "title": "JSP 453 Digital Services Assurance Gate Process",
  "description": "Structured, project-neutral model derived from JSP 453 Digital Services Assurance Playbook concepts, the JSP453 flowchart and DEAB Assurance Matrix evidence categories. It captures gates, authority categories, roles and evidence artefacts without tying them to a specific supplier, tenant or application.",
  "roles": [
    {
      "id": "ROLE-SRO",
      "title": "Senior Responsible Owner",
      "party_type": "authority",
      "description": "Accountable for cyber secure outcomes through the capability lifecycle and for relevant controls being met when engaging with DEAB.",
      "responsibilities": [
        "Takes accountability for relevant controls",
        "Signs off Secure by Design process and accepted project risks",
        "Supports DEAB authority requests"
      ]
    },
    {
      "id": "ROLE-IAO",
      "title": "Information Asset Owner",
      "party_type": "authority",
      "description": "Approves access to and agreed use of data assets where applicable.",
      "responsibilities": [
        "Approves data access and use",
        "Supports information risk decisions"
      ]
    },
    {
      "id": "ROLE-DELIVERY-TEAM-LEAD",
      "title": "Delivery Team Lead",
      "party_type": "internal",
      "description": "Coordinates the project evidence pack and gate submissions.",
      "responsibilities": [
        "Maintains delivery evidence",
        "Coordinates remediation and action tracking"
      ]
    },
    {
      "id": "ROLE-DELIVERY-TEAM-SECURITY-LEAD",
      "title": "Delivery Team Security Lead",
      "party_type": "internal",
      "description": "Coordinates security evidence, risk records, and security assessor engagement.",
      "responsibilities": [
        "Coordinates cyber assurance evidence",
        "Maintains risk and control evidence"
      ]
    },
    {
      "id": "ROLE-JSP453-CASE-OFFICER",
      "title": "JSP 453 Case Officer",
      "party_type": "assurance",
      "description": "Provides case management, assurance triage, the PEF route and evidence collation before DEAB.",
      "responsibilities": [
        "Assurance triage",
        "Provides Programme Engagement Form guidance",
        "Coordinates JSP 453 Evidence Matrix artefacts before DEAB"
      ]
    },
    {
      "id": "ROLE-DEAB",
      "title": "Digital Enterprise Approvals Board",
      "party_type": "authority",
      "description": "Authority for deployment/change, including AtT, IAtO, AtO and CAtO categories.",
      "responsibilities": [
        "Grants Authority to Test",
        "Grants Interim Authority to Operate",
        "Grants Authority to Operate"
      ]
    },
    {
      "id": "ROLE-TDA",
      "title": "Technical Design Authority",
      "party_type": "assurance",
      "description": "Assures project compliance with reference architecture at major decision points.",
      "responsibilities": [
        "Approves HLD and overall design",
        "Reviews architecture/design principles"
      ]
    },
    {
      "id": "ROLE-SOLUTION-ARCHITECT",
      "title": "Technical or Solution Architect",
      "party_type": "internal",
      "description": "Provides design-principles declaration where TDA approval is not yet obtained.",
      "responsibilities": [
        "Produces architecture/design evidence",
        "Confirms design principles have been followed"
      ]
    },
    {
      "id": "ROLE-CYDR-SECURITY-ARCHITECTURE",
      "title": "CyDR Security Architecture",
      "party_type": "assurance",
      "description": "Reviews security architecture and service-zone/cross-domain controls.",
      "responsibilities": [
        "Approves cross-domain solution controls",
        "Reviews service-zone and cyber architecture controls"
      ]
    },
    {
      "id": "ROLE-CYBER-DEFENSIVE-OPERATIONS",
      "title": "Cyber Defensive Operations",
      "party_type": "assurance",
      "description": "Confirms relevant cyber defensive operational controls have been applied.",
      "responsibilities": [
        "Reviews cyber defensive controls",
        "Provides written approval for applied controls"
      ]
    },
    {
      "id": "ROLE-CORE-TEST-SERVICES",
      "title": "Core Test Services",
      "party_type": "assurance",
      "description": "Assures test strategies, plans, RTE and completion evidence for Defence Digital governance gates.",
      "responsibilities": [
        "Reviews test strategy and plans",
        "Reviews representative test environment evidence",
        "Reviews test completion activities"
      ]
    },
    {
      "id": "ROLE-OSM-ONBOARDING",
      "title": "OSM Onboarding",
      "party_type": "assurance",
      "description": "Supports safe integration into live operation and the SIAM ecosystem.",
      "responsibilities": [
        "Assures service onboarding readiness",
        "Supports integration into live operations"
      ]
    },
    {
      "id": "ROLE-SACM",
      "title": "SACM Team",
      "party_type": "assurance",
      "description": "Confirms Configuration Items are recorded in CMS/CMDB.",
      "responsibilities": [
        "Reviews CMDB/CMS registration",
        "Confirms SACM controls"
      ]
    },
    {
      "id": "ROLE-OSM-RESILIENCE",
      "title": "OSM Resilience Team",
      "party_type": "assurance",
      "description": "Confirms ITSCM, availability and capacity controls.",
      "responsibilities": [
        "Reviews service continuity controls",
        "Reviews availability management controls",
        "Reviews capacity management controls"
      ]
    },
    {
      "id": "ROLE-CHANGE-MANAGEMENT",
      "title": "Change Management SME",
      "party_type": "assurance",
      "description": "Confirms change-management process and Forward Schedule of Change evidence.",
      "responsibilities": [
        "Reviews change management plans",
        "Confirms FSoC evidence"
      ]
    },
    {
      "id": "ROLE-CAB",
      "title": "Change Advisory Board",
      "party_type": "authority",
      "description": "Authoritative forum for assessing, prioritising, authorising and scheduling standard and normal live-service changes.",
      "responsibilities": [
        "Assesses business and technical change impact",
        "Authorises and schedules live-service changes",
        "Confirms change risk is acceptable"
      ]
    },
    {
      "id": "ROLE-ECAB",
      "title": "Emergency Change Advisory Board",
      "party_type": "authority",
      "description": "Emergency change authority used when urgent live-service change decisions are required.",
      "responsibilities": [
        "Assesses emergency change justification",
        "Authorises urgent changes",
        "Confirms emergency change risk and rollback approach"
      ]
    },
    {
      "id": "ROLE-SERVICE-OWNER",
      "title": "Service Owner",
      "party_type": "authority",
      "description": "Owns the live service outcome and confirms the operational need and business impact for change.",
      "responsibilities": [
        "Owns live-service impact",
        "Confirms business acceptance of change risk",
        "Supports post-change review"
      ]
    },
    {
      "id": "ROLE-EVENT-MANAGEMENT",
      "title": "Event Management Team",
      "party_type": "assurance",
      "description": "Confirms event-management controls and MDS template evidence.",
      "responsibilities": [
        "Reviews event-management MDS template",
        "Approves event-management controls"
      ]
    },
    {
      "id": "ROLE-KNOWLEDGE-ARTICLE",
      "title": "Knowledge Article Team",
      "party_type": "assurance",
      "description": "Confirms MOD first-line service desk knowledge article evidence.",
      "responsibilities": [
        "Reviews knowledge article submission",
        "Confirms through-life KA maintenance approach"
      ]
    },
    {
      "id": "ROLE-GOSCC-ANNEX-A",
      "title": "GOSCC Annex A Team",
      "party_type": "assurance",
      "description": "Confirms GOSCC Annex A/live support wrapper completion.",
      "responsibilities": [
        "Reviews operational live support wrapper",
        "Confirms Annex A completion"
      ]
    },
    {
      "id": "ROLE-RISK-OWNER",
      "title": "Risk Owner or Senior Risk Officer",
      "party_type": "authority",
      "description": "Reviews exceptions, residual risk and risk acceptance where controls cannot be met.",
      "responsibilities": [
        "Reviews exceptions and design caveats",
        "Supports risk acceptance or remediation decisions"
      ]
    },
    {
      "id": "ROLE-SECOND-LINE-ASSESSOR",
      "title": "Second Line Assessor",
      "party_type": "assurance",
      "description": "Provides second-line assurance where applicable.",
      "responsibilities": [
        "Reviews body of evidence",
        "Provides independent assurance where applicable"
      ]
    },
    {
      "id": "ROLE-SUPPLIER",
      "title": "Supplier or Engineering Team",
      "party_type": "supplier",
      "description": "Provides implementation, test, build, scan and remediation evidence.",
      "responsibilities": [
        "Provides technical evidence",
        "Remediates gate-blocking findings"
      ]
    }
  ],
  "processes": [
    {
      "id": "JSP453-PROC-001",
      "title": "JSP 453 Assurance Path to Authority",
      "description": "End-to-end assurance path based on the JSP453 flowchart and DEAB Assurance Matrix: Front Door, JSP453 triage, assurance planning, AtT, test execution, IAtO, AtO and continual assurance.",
      "entry_conditions": [
        "A Defence Digital service, product or solution requires JSP 453 assurance or DEAB authority to test or operate.",
        "Demand has been raised through the relevant Front Door or Demand Book route."
      ],
      "exit_outcomes": [
        {